[
  {
    "model_id": "CohereForAI/aya-expanse-8b",
    "name": "Aya Expanse 8B",
    "notes": "Excellent multilingual support for 23 languages",
    "is_active": true,
    "load_in_4bit": true
  },
  {
    "model_id": "facebook/nllb-200-1.3B",
    "name": "nllb 200 1.3B",
    "notes": "Translation-focused, fallback for low-resource languages",
    "is_active": true,
    "load_in_4bit": false
  },
  {
    "model_id": "google/gemma-2-9b-it",
    "name": "Gemma 2 9B",
    "notes": "Good for Slovenian, Swahili, Uzbek",
    "is_active": true,
    "load_in_4bit": true
  },
  {
    "model_id": "meta-llama/Llama-3.2-3B-Instruct",
    "name": "Llama 3.2 3B",
    "notes": "Officially supports Hindi, Thai",
    "is_active": true,
    "load_in_4bit": false
  },
  {
    "model_id": "microsoft/Phi-3.5-mini-instruct",
    "name": "Phi 3.5 Mini",
    "notes": "Good Nordic/European language support",
    "is_active": true,
    "load_in_4bit": true
  },
  {
    "model_id": "mistralai/Mistral-7B-Instruct-v0.3",
    "name": "Mistral 7B v0.3",
    "notes": "Excels with German, good with fine-tuning",
    "is_active": true,
    "load_in_4bit": true
  },
  {
    "model_id": "Qwen/Qwen2.5-3B-Instruct",
    "name": "Qwen 2.5 3B",
    "notes": "Lightweight default model",
    "is_active": true,
    "load_in_4bit": false
  },
  {
    "model_id": "Qwen/Qwen2.5-7B-Instruct",
    "name": "Qwen 2.5 7B",
    "notes": "Strong multilingual, best for CJK languages",
    "is_active": true,
    "load_in_4bit": true
  }
]